{
  "schema_version": "repo_federation_manifest_v1",
  "program_id": "spiderweb-pr",
  "repository_full_name": "jotaele44/spiderweb-pr",
  "repository_legacy_name": "spiderweb-pr",
  "federation_role": "spatial_operational_producer",
  "hub_parent": "thehub-pr",
  "branding": {
    "icon": "assets/branding/icon.png",
    "icon_dir": "assets/branding",
    "accent_color": "#ca0c02"
  },
  "jurisdiction": "Puerto Rico",
  "active_vector": "SPIDERWEB_SPATIAL_OPERATIONAL_PRODUCER",
  "production_status": "PRODUCTION",
  "pause_lock_required": true,
  "source_truth": {
    "role_note": "Producer-only: emits a spatial/operational evidence-envelope export that the parent hub (thehub-pr) discovers, validates, and aggregates. Cross-producer correlation is performed by thehub-pr and the downstream PRIIS consumer, not here. The former in-repo query-hub is retired under docs/legacy/federation/hub/ (see docs/REPO_BOUNDARY.md).",
    "producer_side": {
      "export_writer": "federation/export_writer.py",
      "export_envelope": "federation/envelope.py",
      "validator": "scripts/validate_export.py",
      "sample_package": "exports/samples/manifest.sample.json",
      "streams": [
        "events",
        "observations",
        "tracks",
        "sources"
      ],
      "ppp_geometry_lane": "readiness/ppp_geometry.py resolves moneysweep-pr concession projects from a municipality to a WGS84 point using configs/airport_registry.yaml, and scripts/federation_export.py emits the result as anchored canonical observations. Unmatched projects stay in the geocode queue rather than receiving a municipality-centroid guess. Skipped when no moneysweep-pr sibling checkout is present."
    },
    "usgs_native_reference": {
      "adapter": "federation/usgs_native_reference.py",
      "export_entrypoint": "scripts/export_usgs_native.py",
      "package_writer": "scripts/federation_export.py:write_package",
      "scope": "Checksum-verified source-native documentary reference snapshots only",
      "mode": "test",
      "production_export_state": "BLOCKED",
      "activation_state": "BLOCKED",
      "open_gates": [
        "consumer_fitness",
        "PR_coverage",
        "geometry_CRS_Z_M",
        "version_lineage",
        "usage_constraints",
        "domain_semantics"
      ]
    }
  },
  "hub_callable_commands": {
    "setup": "python -m pip install uv && uv pip install --system -e .[airspace,earthgpt,server,dev]",
    "test_suite": "python -m pytest tests/ -q --tb=short",
    "validate_schemas": "python3 scripts/validate_schemas.py --json",
    "validate_export": "python scripts/validate_export.py --package exports/samples --mode test",
    "export_canonical": "python3 scripts/federation_export.py --package exports/real --mode production",
    "maintenance": "python3 scripts/run_maintenance.py --repo spiderweb-pr --mode audit",
    "export_usgs_native_reference": "python3 scripts/export_usgs_native.py --input-manifest <path> --source-root <hub_root> --out <new_empty_package> --mode test"
  },
  "canonical_outputs": {
    "export_sample_manifest": "exports/samples/manifest.sample.json",
    "federation_readiness_doc": "docs/federation_readiness.md",
    "canonical_export_dir": "exports/federation",
    "maintenance_report": "reports/maintenance/latest.json",
    "usgs_native_reference_doc": "docs/USGS_NATIVE_REFERENCE_EXPORT.md"
  },
  "federation_readiness_gate": {
    "ready_for_hub_discovery": true,
    "ready_for_hub_live_execution": true,
    "resolved_conditions": [
      "Z2 geometry projection complete: scripts/federation_export.py projects representative WGS84 location onto canonical record entities for observations, events, and tracks when Point geometry or LineString path data exists.",
      "real (non-synthetic) rows exist: scripts/build_real_spatial_streams.py emits 10 real observations + 2 real sources from committed data (Isabela site record + PR airport registry); build+validate --mode production passes (docs/federation_readiness.md gate)",
      "the parent hub (thehub-pr) validated this producer's canonical package: hub validate-package -> VALID; hub validate-federation classifies spiderweb-pr as declared_not_live with package_valid=true",
      "operator approved the first real production package (2026-07-03 'every follow-up' sweep): ready_for_hub_live_execution flipped true; corpus is small-but-real (1 structure sighting + 9 airport reference locations) and grows with the intake lane",
      "PPP geometry lane: spiderweb resolves moneysweep-pr's municipality-only concession projects to real points and returns them as canonical observations, so thehub-pr's correlate_observations can join a public-money project to a place (hub validate-package -> VALID)."
    ],
    "blocking_conditions": []
  }
}
